{
 "taxonomy_version": "2.0",
 "description": "C6, the taxonomy of check items (design doc 16 §3, design doc 17 §1.3, D56). Taxonomy 2.0 is frozen since 2026-10-14: an id keeps its name, kind, level, dimension and guards; new items take the next free number of their dimension; a dropped id is never reused. 1.x ids map to 2.0 through ``renumbered``.",
 "kinds": {
  "defect": "问题：出现就要报",
  "phenomenon": "现象：要检出、要报告，但本身不算问题",
  "control": "对照：合法情形，不该被报"
 },
 "levels": {
  "episode": "逐条判",
  "dataset": "对整个子集判"
 },
 "dimensions": [
  {
   "id": "FILE",
   "name_zh": "文件与结构"
  },
  {
   "id": "STRM",
   "name_zh": "传感器流与时间"
  },
  {
   "id": "IMG",
   "name_zh": "单路画面质量"
  },
  {
   "id": "MV",
   "name_zh": "多视角一致性"
  },
  {
   "id": "ACT",
   "name_zh": "动作与本体信号"
  },
  {
   "id": "AV",
   "name_zh": "动作与画面的一致性"
  },
  {
   "id": "TASK",
   "name_zh": "任务与步骤"
  },
  {
   "id": "LABEL",
   "name_zh": "标注与描述"
  },
  {
   "id": "SET",
   "name_zh": "数据集级"
  }
 ],
 "renumbered": {
  "from_version": "1.3",
  "ids": {
   "FILE-10": "FILE-9",
   "MV-5": "MV-4",
   "TASK-5": "TASK-4",
   "TASK-6": "TASK-5",
   "TASK-7": "TASK-6",
   "TASK-8": "TASK-7",
   "TASK-10": "TASK-8",
   "TASK-11": "TASK-9",
   "TASK-12": "TASK-10",
   "LABEL-2": "LABEL-1",
   "LABEL-3": "LABEL-2",
   "LABEL-4": "LABEL-3",
   "LABEL-5": "LABEL-4",
   "SET-4": "SET-2",
   "SET-5": "IMG-15"
  },
  "note": "2.0 numbers the items of every dimension again without gaps; ids not listed are unchanged. Ids of different versions are not comparable: map 1.x ids through this table."
 },
 "items": [
  {
   "id": "FILE-1",
   "dimension": "FILE",
   "name_zh": "文件缺失、0 字节、过小",
   "explain_zh": "该有的文件没有，或者文件是空的（0 字节）、小得装不下任何内容。比如某个相机的视频文件压根不存在。",
   "kind": "defect",
   "level": "episode"
  },
  {
   "id": "FILE-2",
   "dimension": "FILE",
   "name_zh": "视频或表格截断、零填充",
   "explain_zh": "文件只写了一半就断了（采集时断电、拷贝中断），或者文件里有一段被 0 填满。表现是文件打不开，或读到一半报错。",
   "kind": "defect",
   "level": "episode"
  },
  {
   "id": "FILE-3",
   "dimension": "FILE",
   "name_zh": "mcap 结构损坏：缺结束标识、结构读不出、CRC 不符",
   "explain_zh": "只针对 mcap：文件尾没有结束标识（录制没有正常收尾），必需的结构读不出来，或者文件里写了的校验码（CRC）对不上，说明内容被改坏了。没有摘要区、CRC 填 0 都是 mcap 规范允许的写法，不算问题。",
   "kind": "defect",
   "level": "episode"
  },
  {
   "id": "FILE-4",
   "dimension": "FILE",
   "name_zh": "视频解码失败",
   "explain_zh": "文件能打开，但有帧解不出来。例：录制从两个关键帧之间开始，开头约一秒的包缺参考帧，解不出画面（GenRobot 的 22 条，从第一个关键帧起就正常）。和 FILE-2 的区别：文件结构是好的，是里面某些帧坏了或缺参考。",
   "kind": "defect",
   "level": "episode"
  },
  {
   "id": "FILE-5",
   "dimension": "FILE",
   "name_zh": "帧数与声明不符、各路不等长",
   "explain_zh": "元数据说有 300 帧，实际视频只有 280 帧；或者几路相机、动作表的长度对不上。",
   "kind": "defect",
   "level": "episode"
  },
  {
   "id": "FILE-6",
   "dimension": "FILE",
   "name_zh": "数值非法",
   "explain_zh": "动作 / 状态数据里出现 NaN、无穷大，或者数组形状不对（比如声明 14 维、实际 13 维）。",
   "kind": "defect",
   "level": "episode"
  },
  {
   "id": "FILE-7",
   "dimension": "FILE",
   "name_zh": "分辨率不符或不一",
   "explain_zh": "视频实际分辨率和元数据写的不一样；或者同一个数据集里不同条目的分辨率不一样。",
   "kind": "defect",
   "level": "dataset"
  },
  {
   "id": "FILE-8",
   "dimension": "FILE",
   "name_zh": "元数据自相矛盾、和实际不符",
   "explain_zh": "机器读的元数据前后打架，或者和实际数据对不上（比如写 30 fps、实际 20 fps，写 300 帧、实际 280 帧）。描述类文字字段里的占位符（如 TODO）不在这里，归 LABEL-2。",
   "kind": "defect",
   "level": "dataset"
  },
  {
   "id": "FILE-9",
   "dimension": "FILE",
   "name_zh": "索引与引用对不上",
   "explain_zh": "表里的索引或引用指错了：帧号重复或跳号、episode 编号和它所在的位置对不上、任务编号指向不存在的任务；LeRobot v3 里一条 episode 在共享文件里的起止偏移写错，读出来会混进别的 episode 的数据。",
   "kind": "defect",
   "level": "episode"
  },
  {
   "id": "STRM-1",
   "dimension": "STRM",
   "name_zh": "传感器流缺失",
   "explain_zh": "整路数据从头到尾都没有：某个相机没有画面（整条是黑帧或 No Signal 之类的占位画面），或者某个传感器的数据整列缺失。例：RH20T 里没接相机的那几列全是黑帧；FastUMI 加米任务 2604 号的右相机整条是 No Signal。",
   "kind": "defect",
   "level": "episode"
  },
  {
   "id": "STRM-2",
   "dimension": "STRM",
   "name_zh": "传感器流中途掉线",
   "explain_zh": "一开始有、中途断了：相机录到一半变成 No Signal 或停住，或者动作数据录到一半不再更新。例：G01 右腕相机第 217 帧起变成 No Signal。从第一帧起就没有的算 STRM-1。",
   "kind": "defect",
   "level": "episode"
  },
  {
   "id": "STRM-3",
   "dimension": "STRM",
   "name_zh": "丢帧、时间跳变",
   "explain_zh": "相邻两帧的时间戳之间出现大空档，说明中间丢了一些帧或一段数据。",
   "kind": "defect",
   "level": "episode"
  },
  {
   "id": "STRM-4",
   "dimension": "STRM",
   "name_zh": "时间戳非单调、重复",
   "explain_zh": "时间戳往回走，或者两帧的时间戳一样，时间线本身是乱的。",
   "kind": "defect",
   "level": "episode"
  },
  {
   "id": "STRM-5",
   "dimension": "STRM",
   "name_zh": "残段、过短",
   "explain_zh": "条目短得不像一次完整操作，比如只有 1 帧或不到 1 秒，多半是误触录制或切分出错。",
   "kind": "defect",
   "level": "episode"
  },
  {
   "id": "STRM-6",
   "dimension": "STRM",
   "name_zh": "出帧不均匀",
   "explain_zh": "时间戳看着是均匀的，但画面其实一会儿快一会儿慢（相机实际出帧不均匀，靠重复帧凑数）。",
   "kind": "defect",
   "level": "episode"
  },
  {
   "id": "STRM-7",
   "dimension": "STRM",
   "name_zh": "画面剪切、缺一小段",
   "explain_zh": "视频中间少了一小段，看起来像突然快进了一下。例：G06。",
   "kind": "defect",
   "level": "episode"
  },
  {
   "id": "STRM-8",
   "dimension": "STRM",
   "name_zh": "对照：各流各有时钟",
   "explain_zh": "对照项：不同传感器各用各的时钟、频率不同，这是正常的，不应该被当成丢帧或错位。",
   "kind": "control",
   "level": "dataset",
   "guards": [
    "STRM-3",
    "AV-1"
   ]
  },
  {
   "id": "STRM-9",
   "dimension": "STRM",
   "name_zh": "时间比例错误（快进 / 慢放）",
   "explain_zh": "按时间戳播放时，视频比真实世界快或慢，比如采集时跳了帧、时间戳却按正常间隔写。",
   "kind": "defect",
   "level": "episode"
  },
  {
   "id": "IMG-1",
   "dimension": "IMG",
   "name_zh": "画面冻结",
   "explain_zh": "相机画面卡住不动，但机器人其实在动。要和真正静止的画面区分开：冻结时别的相机或动作数据还在变。整条都是 No Signal 之类占位画面的，主记 STRM-1，冻结只是它的表现。",
   "kind": "defect",
   "level": "episode"
  },
  {
   "id": "IMG-2",
   "dimension": "IMG",
   "name_zh": "过暗、过曝",
   "explain_zh": "画面太黑或太亮，看不清内容。例：G07 两路腕部相机整条都很暗。",
   "kind": "defect",
   "level": "episode"
  },
  {
   "id": "IMG-3",
   "dimension": "IMG",
   "name_zh": "低对比",
   "explain_zh": "画面灰蒙蒙、没有层次，细节糊在一起（不一定偏暗或偏亮）。",
   "kind": "defect",
   "level": "episode"
  },
  {
   "id": "IMG-4",
   "dimension": "IMG",
   "name_zh": "模糊、失焦",
   "explain_zh": "画面糊：对焦不准或运动太快拖影，看不清物体和夹爪。",
   "kind": "defect",
   "level": "episode"
  },
  {
   "id": "IMG-5",
   "dimension": "IMG",
   "name_zh": "花屏",
   "explain_zh": "画面出现马赛克色块、条纹、错位撕裂等损坏的样子，但文件还能播放。",
   "kind": "defect",
   "level": "episode"
  },
  {
   "id": "IMG-6",
   "dimension": "IMG",
   "name_zh": "相机抖动",
   "explain_zh": "画面不正常地晃（相机没固定好、支架松动）。手持或装在手腕上的相机跟着操作晃动是正常的运镜，不算。",
   "kind": "defect",
   "level": "episode"
  },
  {
   "id": "IMG-7",
   "dimension": "IMG",
   "name_zh": "镜头污染",
   "explain_zh": "镜头上有油污、水滴、灰尘，画面某一块一直糊或有斑。和遮挡不同：污渍跟着镜头走，不随场景变。",
   "kind": "defect",
   "level": "episode"
  },
  {
   "id": "IMG-8",
   "dimension": "IMG",
   "name_zh": "视觉遮挡",
   "explain_zh": "关键区域被东西挡住，看不到操作。例：G11 右腕相机被衣物盖住一段。",
   "kind": "defect",
   "level": "episode"
  },
  {
   "id": "IMG-9",
   "dimension": "IMG",
   "name_zh": "Depth 空洞、噪声",
   "explain_zh": "深度图里大面积没有数据（空洞）或数值乱跳（噪声）。样本集里目前只记了读数（空洞占比），该报的线还没定。",
   "kind": "defect",
   "level": "episode"
  },
  {
   "id": "IMG-10",
   "dimension": "IMG",
   "name_zh": "对照：自动曝光、光照突变",
   "explain_zh": "对照项：相机自动调曝光、开关灯导致亮度突然变化，这是正常的，不该报。例：G12。",
   "kind": "control",
   "level": "episode",
   "guards": [
    "IMG-1",
    "IMG-2"
   ]
  },
  {
   "id": "IMG-11",
   "dimension": "IMG",
   "name_zh": "对照：特殊画面",
   "explain_zh": "对照项：鱼眼、超宽画幅等不常见但正常的画面，不该报。",
   "kind": "control",
   "level": "episode",
   "guards": [
    "IMG-2",
    "IMG-4"
   ]
  },
  {
   "id": "IMG-12",
   "dimension": "IMG",
   "name_zh": "相机移位、安装状态改变",
   "explain_zh": "录制途中相机被碰歪、取下或换了角度，前后视角不一样。",
   "kind": "defect",
   "level": "episode"
  },
  {
   "id": "IMG-13",
   "dimension": "IMG",
   "name_zh": "任务物体或末端出画",
   "explain_zh": "要操作的东西或夹爪有一段时间跑出了所有相机的画面，这段只有动作数据、没有画面。和 IMG-8 的区别：IMG-8 是该看见的地方被东西挡住，这一项是根本没拍到。",
   "kind": "defect",
   "level": "episode"
  },
  {
   "id": "IMG-14",
   "dimension": "IMG",
   "name_zh": "脱敏模糊遮住任务物体",
   "explain_zh": "为保护隐私给人脸打码，结果把要操作的物体或操作区域也糊掉了，看不清操作。是预处理造成的，不是相机的问题。",
   "kind": "defect",
   "level": "episode"
  },
  {
   "id": "IMG-15",
   "dimension": "IMG",
   "name_zh": "隐私与安全",
   "explain_zh": "画面里出现人脸、无关人员或其他敏感信息。逐条判：哪几条、哪路相机的画面里有，就报哪几条，范围写到相机。",
   "kind": "defect",
   "level": "episode"
  },
  {
   "id": "MV-1",
   "dimension": "MV",
   "name_zh": "多视角内容不一致",
   "explain_zh": "几路相机拍的应当是同一时刻的同一场景；如果一路停了、黑了，或者拍的不是同一回事，就算不一致。那一路自己的问题（冻结、掉线、被挡住）同时记在它的 STRM / IMG 项上。例：G01、G02。",
   "kind": "defect",
   "level": "episode"
  },
  {
   "id": "MV-2",
   "dimension": "MV",
   "name_zh": "左右手、机位身份一致",
   "explain_zh": "标签写的「左腕相机」实际拍的是右手，或者前视和腕部相机标反了、两个视频文件对调了。例：camera_swap 系列子集、FastUMI 的对调条目。",
   "kind": "defect",
   "level": "episode"
  },
  {
   "id": "MV-3",
   "dimension": "MV",
   "name_zh": "多视角时间不同步",
   "explain_zh": "同一个事件（比如夹爪闭合）在各路相机里出现的时间应当一样；某一路早了或晚了，就是不同步。",
   "kind": "defect",
   "level": "episode"
  },
  {
   "id": "MV-4",
   "dimension": "MV",
   "name_zh": "相机标定、末端投影与画面不符",
   "explain_zh": "用标定参数把机械臂末端的位置投到画面上，应当正好落在夹爪上；投偏了说明标定或坐标系有错。",
   "kind": "defect",
   "level": "episode"
  },
  {
   "id": "ACT-1",
   "dimension": "ACT",
   "name_zh": "动作呈锯齿",
   "explain_zh": "动作或状态曲线来回小幅抖动，像锯齿，不像正常运动那样平滑。",
   "kind": "defect",
   "level": "episode"
  },
  {
   "id": "ACT-2",
   "dimension": "ACT",
   "name_zh": "单点大跳变",
   "explain_zh": "某一帧的位置突然跳一大截、下一帧又回来，画面里却没有相应的动作。例：G03 左臂一帧跳了 10 cm。",
   "kind": "defect",
   "level": "episode"
  },
  {
   "id": "ACT-3",
   "dimension": "ACT",
   "name_zh": "某个通道全程不动",
   "explain_zh": "某个通道（最常见的是夹爪开合）从头到尾只有一个值，但它本该变化：画面里夹爪明明在开合，或者任务离不开开合。只看数值恒定只是候选，合法的情形有：全程夹着东西、这只手根本没用上。例：G09。",
   "kind": "defect",
   "level": "episode"
  },
  {
   "id": "ACT-4",
   "dimension": "ACT",
   "name_zh": "关节位置、速度越限",
   "explain_zh": "关节角度或速度超出这台机器人的物理极限（按平台的本体规格表判断）。",
   "kind": "defect",
   "level": "episode"
  },
  {
   "id": "ACT-5",
   "dimension": "ACT",
   "name_zh": "夹爪量程越界、传感器毛刺",
   "explain_zh": "夹爪读数超出合理范围，或者偶尔冒出一个离谱的尖刺值。两件事分开查：没有尖刺不代表量程没问题，量程要对照硬件规格和单位。",
   "kind": "defect",
   "level": "episode"
  },
  {
   "id": "ACT-6",
   "dimension": "ACT",